{"schema_id":"OPM-DEV-CANVAS-05-HANDOFF-001","schema_version":"0.1","handoff_id":"dev-canvas-05.profile.iso19450.2024.draft.0.2.0.f76ff7101130","handoff_status":"READY_FOR_DEV_CANVAS_06","generated_at":"2026-07-31T01:37:44.903Z","source_build":{"source_commit":"f76ff710113084411901ce2d4e37bef448f2ebd9","dirty_before_build":false,"evidence_output_root":"reports","java_version":"java version \"21.0.7\" 2025-04-15 LTS\nJava(TM) SE Runtime Environment Oracle GraalVM 21.0.7+8.1 (build 21.0.7+8-LTS-jvmci-23.1-b60)\nJava HotSpot(TM) 64-Bit Server VM Oracle GraalVM 21.0.7+8.1 (build 21.0.7+8-LTS-jvmci-23.1-b60, mixed mode, sharing)","node_version":"v22.22.0","os":"darwin-arm64","build_command":"npm run golden:coverage && npm run golden:replay && npm run compatibility:replay && npm run handoff:evidence && ./mvnw -o -pl services/local-runtime package -DskipTests","lockfile_sha256":"ac0904e4126caa51eb1a901cfdca6c73b1458e19fad0d70beeccdd86110b6dee","pom_sha256":"728b2975f854a78fdad2708cf9c27f34c2eeed2a8975d4d85a0f27370469228a"},"build_artifacts":[{"kind":"LOCAL_RUNTIME_JAR","path":"release/local-runtime-0.1.0-SNAPSHOT.jar","byte_length":39308369,"sha256":"a8cf29b9b63fa8780f145e6ea2d806cac70054d2ae6796c42a1f0f5d6002760b"},{"kind":"EVIDENCE_BUNDLE","path":"release/dev-canvas-05-evidence-bundle.jar","byte_length":678674,"sha256":"fa54b828de74eb0bad7ba3143ea0fd0cabe0110eab3349b5c7596f2e7ef0adb9"}],"revision_contract":{"reader_versions":["0.1","0.2"],"active_writer_version":"0.2","schemas":[{"kind":"SCHEMA","path":"reports/revision-v01.schema.json","byte_length":17828,"sha256":"437e63bfae925f44e2a0bbed3b52c7f45957ff91fb6d71e989c72f95ad3396c8"},{"kind":"SCHEMA","path":"reports/revision-v02.schema.json","byte_length":18074,"sha256":"36cede0a2d7fbcf67e80415d3a7e9713e25cb6734032feb72cbf88d0f95f4fdc"}]},"historical_binding":{"profile":{"id":"profile.iso19450.2024.draft","version":"0.1.0","sha256":"4cc3289722ab5c62e9273127318d5dcb383f7f0bdb801d23293afdef48fcbb00"},"rule_set":{"id":"rules.iso19450.2024.draft","version":"0.1.0","sha256":"4293cb22cf2e2e92fe212ed3c31119992509c8a675daa554c64a2ccf10457d64"},"text_grammar":{"id":"grammar.opl.iso19450.2024.draft","version":"0.1.0","sha256":"be315186135f2cfa525128532220b289e083fa4bc70bacb33a4287331467a9d1"},"symbol_catalog":{"id":"symbols.iso19450.2024.draft","version":"0.1.0","sha256":"511dbaec2adb6f49ed6a4d28844e69d1310eb7a67f213e4a30b0ddfc21ef6098"},"normalization_adapter":{"id":"normalization.iso19450.2024.draft","version":"0.1.0","sha256":"6401336ad4b63127047ccd5d50cc418554f0c8490547a6024939b4da5774194c"},"binding_digest":"35bf8490cdd363bc29380cc560d2667a70b72e474b739925b2cda4a598e3c037"},"active_binding":{"profile":{"id":"profile.iso19450.2024.draft","version":"0.2.0","sha256":"5287d3ceb77c4c664b88c6e34a3a5d1c34f85c36037ab2f587705f9d607f899c"},"rule_set":{"id":"rules.iso19450.2024.draft","version":"0.1.0","sha256":"4293cb22cf2e2e92fe212ed3c31119992509c8a675daa554c64a2ccf10457d64"},"text_grammar":{"id":"grammar.opl.iso19450.2024.draft","version":"0.2.0","sha256":"c88e672bd9db7f0405a7ef3fc464043f15cae844931192e3412c94ce05339e7d"},"symbol_catalog":{"id":"symbols.iso19450.2024.draft","version":"0.1.0","sha256":"511dbaec2adb6f49ed6a4d28844e69d1310eb7a67f213e4a30b0ddfc21ef6098"},"normalization_adapter":{"id":"normalization.iso19450.2024.draft","version":"0.1.0","sha256":"6401336ad4b63127047ccd5d50cc418554f0c8490547a6024939b4da5774194c"},"binding_digest":"93805d6e2fdb3ea73c4ddfc0a995d662fbf13dee2d8a6f24fc20c79ecff65d1d"},"gate_evidence":[{"gate_id":"GATE-05-01","status":"MATCHED","evidence":{"kind":"REPORT","path":"reports/golden-contract.json","byte_length":1130,"sha256":"f279bee2366d6c8ea3a2cd6ce54fe799812c73afe592cddd904dea3af432cf3c"},"summary":"Golden Contract 的 16 个细粒度 mutation 已全部匹配。"},{"gate_id":"GATE-05-02","status":"MATCHED","evidence":{"kind":"REPORT","path":"reports/golden-replay.json","byte_length":215314,"sha256":"3e3c9d9e6e444e30ed86fbca9cf10e2923f236e7acd84630bdd68ee9efe5b3da"},"summary":"178 个 Golden case 重放通过。"},{"gate_id":"GATE-05-03","status":"MATCHED","evidence":{"kind":"REPORT","path":"reports/golden-coverage.json","byte_length":1567,"sha256":"bff75db7ef94ec2de7056fa5db410641e6605f52a466f8c771c5f8cbac504565"},"summary":"Coverage 精确匹配 178 个需求。"},{"gate_id":"GATE-05-04","status":"MATCHED","evidence":{"kind":"REPORT","path":"reports/trace-closure.json","byte_length":1199,"sha256":"87684a3b631c13e3bb83c91b2e3e1fd49545b8963de47d5f26ce55af63b74b0b"},"summary":"Token/Trace Closure 的 JDK 21 测试和 Golden Trace SHA 闭包已匹配。"},{"gate_id":"GATE-05-05","status":"MATCHED","evidence":{"kind":"REPORT","path":"reports/golden-replay.json","byte_length":215314,"sha256":"3e3c9d9e6e444e30ed86fbca9cf10e2923f236e7acd84630bdd68ee9efe5b3da"},"summary":"19 个 Atomic case 与 24 个 Structural concrete template 均已验证。"},{"gate_id":"GATE-05-06","status":"MATCHED","evidence":{"kind":"REPORT","path":"reports/revision-compatibility.json","byte_length":16936,"sha256":"dbfd01966203ddb7b40b6b2e0552b41ef2fe2aae43dd3f7d69943e72e2758f08"},"summary":"Revision Compatibility 13/13 已匹配。"}],"coverage_summary":{"semantic":{"expected":178,"pass":130,"blocked":48},"atomic":{"expected":19,"matched":19},"structural":{"expected":24,"matched":24},"control":{"expected":20,"matched":20},"failed":0,"evidence":[{"kind":"ASSET","path":"reports/golden-coverage-catalog.json","byte_length":99105,"sha256":"dfde1f5b9ae003b8455712378b2a06439a0212682d79253739443e2734fe7466"},{"kind":"ASSET","path":"reports/golden-manifest.json","byte_length":3766673,"sha256":"8aaca22c69402e08ff58a4a3e19eb38b260511dc7649c1deae8ac4fffce280a7"},{"kind":"ASSET","path":"reports/active-grammar.json","byte_length":15930,"sha256":"c88e672bd9db7f0405a7ef3fc464043f15cae844931192e3412c94ce05339e7d"},{"kind":"REPORT","path":"reports/golden-coverage.json","byte_length":1567,"sha256":"bff75db7ef94ec2de7056fa5db410641e6605f52a466f8c771c5f8cbac504565"},{"kind":"REPORT","path":"reports/golden-replay.json","byte_length":215314,"sha256":"3e3c9d9e6e444e30ed86fbca9cf10e2923f236e7acd84630bdd68ee9efe5b3da"}]},"compatibility_summary":{"case_count":13,"pass_count":6,"blocked_count":7,"failed_count":0,"evidence":{"kind":"REPORT","path":"reports/revision-compatibility.json","byte_length":16936,"sha256":"dbfd01966203ddb7b40b6b2e0552b41ef2fe2aae43dd3f7d69943e72e2758f08"}},"capability_evidence":[{"capability_id":"CAP-ISO-PROC-001","family":"PROC","eligibility":"ELIGIBLE_FOR_RELEASE_VALIDATION","coverage_keys":["PROC:CAP-ISO-PROC-001:-:CONSUMPTION_OBJECT:PASS","PROC:CAP-ISO-PROC-001:-:ENDPOINTS_REVERSED:BLOCKED"],"template_ref":"opl.consumption.v1","rule_ref":"rule.iso.proc.consumption.endpoints.v1","symbol_ref":"symbol.link.consumption","grammar":{"id":"grammar.opl.iso19450.2024.draft","version":"0.2.0","sha256":"c88e672bd9db7f0405a7ef3fc464043f15cae844931192e3412c94ce05339e7d"},"binding_digest":"93805d6e2fdb3ea73c4ddfc0a995d662fbf13dee2d8a6f24fc20c79ecff65d1d","disabled_reason":"DEV_CANVAS_06_VALIDATION_REQUIRED"},{"capability_id":"CAP-ISO-PROC-002","family":"PROC","eligibility":"ELIGIBLE_FOR_RELEASE_VALIDATION","coverage_keys":["PROC:CAP-ISO-PROC-002:-:RESULT_OBJECT:PASS","PROC:CAP-ISO-PROC-002:-:ENDPOINTS_REVERSED:BLOCKED"],"template_ref":"opl.result.v1","rule_ref":"rule.iso.proc.result.endpoints.v1","symbol_ref":"symbol.link.result","grammar":{"id":"grammar.opl.iso19450.2024.draft","version":"0.2.0","sha256":"c88e672bd9db7f0405a7ef3fc464043f15cae844931192e3412c94ce05339e7d"},"binding_digest":"93805d6e2fdb3ea73c4ddfc0a995d662fbf13dee2d8a6f24fc20c79ecff65d1d","disabled_reason":"DEV_CANVAS_06_VALIDATION_REQUIRED"},{"capability_id":"CAP-ISO-PROC-003","family":"PROC","eligibility":"ELIGIBLE_FOR_RELEASE_VALIDATION","coverage_keys":["PROC:CAP-ISO-PROC-003:-:EFFECT_OBJECT:PASS","PROC:CAP-ISO-PROC-003:-:ENDPOINTS_REVERSED:BLOCKED"],"template_ref":"opl.effect.v1","rule_ref":"rule.iso.proc.effect.endpoints.v1","symbol_ref":"symbol.link.effect","grammar":{"id":"grammar.opl.iso19450.2024.draft","version":"0.2.0","sha256":"c88e672bd9db7f0405a7ef3fc464043f15cae844931192e3412c94ce05339e7d"},"binding_digest":"93805d6e2fdb3ea73c4ddfc0a995d662fbf13dee2d8a6f24fc20c79ecff65d1d","disabled_reason":"DEV_CANVAS_06_VALIDATION_REQUIRED"},{"capability_id":"CAP-ISO-PROC-004","family":"PROC","eligibility":"ELIGIBLE_FOR_RELEASE_VALIDATION","coverage_keys":["PROC:CAP-ISO-PROC-004:-:AGENT_OBJECT:PASS","PROC:CAP-ISO-PROC-004:-:ENDPOINTS_REVERSED:BLOCKED"],"template_ref":"opl.agent.v1","rule_ref":"rule.iso.proc.agent.endpoints.v1","symbol_ref":"symbol.link.agent","grammar":{"id":"grammar.opl.iso19450.2024.draft","version":"0.2.0","sha256":"c88e672bd9db7f0405a7ef3fc464043f15cae844931192e3412c94ce05339e7d"},"binding_digest":"93805d6e2fdb3ea73c4ddfc0a995d662fbf13dee2d8a6f24fc20c79ecff65d1d","disabled_reason":"DEV_CANVAS_06_VALIDATION_REQUIRED"},{"capability_id":"CAP-ISO-PROC-005","family":"PROC","eligibility":"ELIGIBLE_FOR_RELEASE_VALIDATION","coverage_keys":["PROC:CAP-ISO-PROC-005:-:INSTRUMENT_OBJECT:PASS","PROC:CAP-ISO-PROC-005:-:ENDPOINTS_REVERSED:BLOCKED"],"template_ref":"opl.instrument.v1","rule_ref":"rule.iso.proc.instrument.endpoints.v1","symbol_ref":"symbol.link.instrument","grammar":{"id":"grammar.opl.iso19450.2024.draft","version":"0.2.0","sha256":"c88e672bd9db7f0405a7ef3fc464043f15cae844931192e3412c94ce05339e7d"},"binding_digest":"93805d6e2fdb3ea73c4ddfc0a995d662fbf13dee2d8a6f24fc20c79ecff65d1d","disabled_reason":"DEV_CANVAS_06_VALIDATION_REQUIRED"},{"capability_id":"CAP-ISO-PROC-006","family":"PROC","eligibility":"ELIGIBLE_FOR_RELEASE_VALIDATION","coverage_keys":["PROC:CAP-ISO-PROC-006:-:CONSUMPTION_STATE:PASS","PROC:CAP-ISO-PROC-006:-:STATE_OWNER_MISMATCH:BLOCKED"],"template_ref":"opl.consumption.state.v1","rule_ref":"rule.iso.proc.state-consumption.endpoints.v1","symbol_ref":"symbol.link.consumption.state","grammar":{"id":"grammar.opl.iso19450.2024.draft","version":"0.2.0","sha256":"c88e672bd9db7f0405a7ef3fc464043f15cae844931192e3412c94ce05339e7d"},"binding_digest":"93805d6e2fdb3ea73c4ddfc0a995d662fbf13de